{
  "$schema": "https://json-schema.org/draft/2020-12/schema",
  "$id": "https://nexus-lab-test-bed.local/contracts/domain/meeting-action-item.schema.json",
  "title": "meeting-action-item",
  "type": "array",
  "items": {
    "type": "object",
    "additionalProperties": false,
    "properties": {
      "action_item_code": {
        "$ref": "https://nexus-lab-test-bed.local/contracts/domain/domain-common.schema.json#/$defs/code"
      },
      "meeting_code": {
        "$ref": "https://nexus-lab-test-bed.local/contracts/domain/domain-common.schema.json#/$defs/code"
      },
      "owner_actor_id": {
        "$ref": "https://nexus-lab-test-bed.local/contracts/domain/domain-common.schema.json#/$defs/slug"
      },
      "due_at": {
        "$ref": "https://nexus-lab-test-bed.local/contracts/domain/domain-common.schema.json#/$defs/datetime"
      },
      "status": {
        "type": "string",
        "minLength": 1
      },
      "description": {
        "type": "string",
        "minLength": 1
      }
    },
    "required": [
      "action_item_code",
      "meeting_code",
      "owner_actor_id",
      "due_at",
      "status",
      "description"
    ]
  }
}
